{
  "$schema": "https://json-schema.org/draft/2020-12/schema",
  "$id": "https://will-platform.ro/contracts/will.dea.event.v0/event.schema.json",
  "title": "will.dea.event.v0 — DEA audit event",
  "description": "Per-event audit record emitted by will-doctrine as an envelope moves through its lifecycle. Forms a tamper-evident hash chain per tenant. See ADR-019 for doctrine; see README.md in this directory for a plain-language walkthrough.",
  "type": "object",
  "additionalProperties": false,
  "required": [
    "schema",
    "event_id",
    "event_type",
    "occurred_at",
    "tenant_id",
    "classification",
    "source_service",
    "ledger_prev_hash",
    "payload",
    "signature"
  ],
  "properties": {
    "schema": { "const": "will.dea.event.v0" },
    "event_id": { "type": "string", "format": "uuid" },
    "event_type": {
      "enum": [
        "envelope.committed",
        "envelope.revoked",
        "envelope.expired",
        "candidate.allowed",
        "candidate.dropped",
        "authorisation.pushed",
        "engagement.ack",
        "abort.family_halt",
        "abort.tenant_all",
        "magazine.updated"
      ]
    },
    "occurred_at": { "type": "string", "format": "date-time" },
    "tenant_id": { "type": "string", "format": "uuid" },
    "envelope_id": {
      "oneOf": [
        { "type": "string", "format": "uuid" },
        { "type": "null" }
      ],
      "description": "Reference to the envelope this event pertains to. MUST be a UUID for every event_type except abort.tenant_all (which is a tenant-wide action and MUST have envelope_id null)."
    },
    "envelope_snapshot_hash": {
      "oneOf": [
        { "type": "string", "pattern": "^[A-Fa-f0-9]{64}$" },
        { "type": "null" }
      ],
      "description": "SHA-256 of the canonical envelope at commitment time. Null iff envelope_id is null."
    },
    "classification": {
      "enum": [
        "NESECRET",
        "SECRET_DE_SERVICIU",
        "SECRET",
        "STRICT_SECRET",
        "STRICT_SECRET_DE_IMPORTANTA_DEOSEBITA",
        "NATO_UNCLASSIFIED",
        "NATO_RESTRICTED",
        "NATO_CONFIDENTIAL",
        "NATO_SECRET"
      ]
    },
    "source_service": {
      "type": "object",
      "additionalProperties": false,
      "required": ["name", "version", "instance_id"],
      "properties": {
        "name": { "type": "string", "pattern": "^[a-z][a-z0-9-]{1,63}$" },
        "version": { "type": "string", "pattern": "^\\d+\\.\\d+\\.\\d+$" },
        "instance_id": { "type": "string", "minLength": 1, "maxLength": 128 }
      }
    },
    "ledger_prev_hash": {
      "type": "string",
      "pattern": "^[A-Fa-f0-9]{64}$",
      "description": "SHA-256 of the previous event in this tenant's ledger, canonical form. The very first event in a tenant's ledger uses the well-known genesis constant '0000000000000000000000000000000000000000000000000000000000000000'."
    },
    "payload": {
      "type": "object",
      "description": "Kind-specific payload. Shape depends on event_type; enforced by the allOf/if/then blocks below."
    },
    "signature": {
      "type": "object",
      "additionalProperties": false,
      "required": ["algorithm", "key_ref", "value", "signed_over"],
      "properties": {
        "algorithm": { "enum": ["Ed25519", "ECDSA-P256"] },
        "key_ref": { "type": "string" },
        "value": { "type": "string", "contentEncoding": "base64" },
        "signed_over": {
          "type": "array",
          "minItems": 1,
          "items": { "type": "string" }
        }
      }
    }
  },
  "allOf": [
    {
      "description": "abort.tenant_all is the only event without an envelope_id",
      "if": { "properties": { "event_type": { "const": "abort.tenant_all" } } },
      "then": {
        "properties": {
          "envelope_id": { "type": "null" },
          "envelope_snapshot_hash": { "type": "null" }
        }
      },
      "else": {
        "properties": {
          "envelope_id": { "type": "string", "format": "uuid" },
          "envelope_snapshot_hash": { "type": "string", "pattern": "^[A-Fa-f0-9]{64}$" }
        }
      }
    },
    {
      "if": { "properties": { "event_type": { "const": "envelope.committed" } } },
      "then": {
        "properties": {
          "payload": {
            "type": "object",
            "additionalProperties": false,
            "required": ["committer_ref", "envelope_signature_algorithm", "envelope_signature_key_ref"],
            "properties": {
              "committer_ref": { "$ref": "#/$defs/IdentityRef" },
              "envelope_signature_algorithm": { "enum": ["Ed25519", "ECDSA-P256"] },
              "envelope_signature_key_ref": { "type": "string" }
            }
          }
        }
      }
    },
    {
      "if": { "properties": { "event_type": { "const": "envelope.revoked" } } },
      "then": {
        "properties": {
          "payload": {
            "type": "object",
            "additionalProperties": false,
            "required": ["revoker_ref", "reason_code"],
            "properties": {
              "revoker_ref": { "$ref": "#/$defs/IdentityRef" },
              "reason_code": { "type": "string", "pattern": "^ROU-REV-[A-Z0-9-]{2,64}$" },
              "reason_note": { "type": "string", "maxLength": 4096 }
            }
          }
        }
      }
    },
    {
      "if": { "properties": { "event_type": { "const": "envelope.expired" } } },
      "then": {
        "properties": {
          "payload": {
            "type": "object",
            "additionalProperties": false
          }
        }
      }
    },
    {
      "if": { "properties": { "event_type": { "const": "candidate.allowed" } } },
      "then": {
        "properties": {
          "payload": {
            "type": "object",
            "additionalProperties": false,
            "required": ["track_id", "track_snapshot_hash", "fusion_confidence", "app6d_sidc", "effector_family_selected"],
            "properties": {
              "track_id": { "type": "string", "minLength": 1, "maxLength": 256 },
              "track_snapshot_hash": { "type": "string", "pattern": "^[A-Fa-f0-9]{64}$" },
              "fusion_confidence": { "type": "number", "minimum": 0, "maximum": 1 },
              "app6d_sidc": { "type": "string", "pattern": "^S[FHNU][A-Z].*$" },
              "effector_family_selected": { "type": "string", "pattern": "^[a-z0-9][a-z0-9._-]*(/[a-z0-9*._-]+)+$" }
            }
          }
        }
      }
    },
    {
      "if": { "properties": { "event_type": { "const": "candidate.dropped" } } },
      "then": {
        "properties": {
          "payload": {
            "type": "object",
            "additionalProperties": false,
            "required": ["track_id", "track_snapshot_hash", "drop_reason"],
            "properties": {
              "track_id": { "type": "string", "minLength": 1, "maxLength": 256 },
              "track_snapshot_hash": { "type": "string", "pattern": "^[A-Fa-f0-9]{64}$" },
              "drop_reason": {
                "enum": [
                  "OUT_OF_SECTOR",
                  "OUT_OF_TIME_WINDOW",
                  "TARGET_CLASS_NOT_ALLOWED",
                  "CLASSIFICATION_ABOVE_CEILING",
                  "WEAPONS_STATE_NOT_FREE",
                  "FUSION_CONFIDENCE_BELOW_FLOOR",
                  "MAGAZINE_EXHAUSTED",
                  "ENVELOPE_INACTIVE",
                  "EFFECTOR_UNAVAILABLE",
                  "ABORT_ACTIVE",
                  "OTHER"
                ]
              },
              "drop_reason_detail": { "type": "string", "maxLength": 4096 }
            },
            "allOf": [
              {
                "if": { "properties": { "drop_reason": { "const": "OTHER" } } },
                "then": { "required": ["drop_reason_detail"] }
              }
            ]
          }
        }
      }
    },
    {
      "if": { "properties": { "event_type": { "const": "authorisation.pushed" } } },
      "then": {
        "properties": {
          "payload": {
            "type": "object",
            "additionalProperties": false,
            "required": ["correlation_id", "track_id", "effector_family", "gateway_ref"],
            "properties": {
              "correlation_id": { "type": "string", "pattern": "^auth-[A-Za-z0-9._-]{4,128}$" },
              "track_id": { "type": "string", "minLength": 1, "maxLength": 256 },
              "effector_family": { "type": "string", "pattern": "^[a-z0-9][a-z0-9._-]*(/[a-z0-9*._-]+)+$" },
              "gateway_ref": { "type": "string", "minLength": 1, "maxLength": 256 }
            }
          }
        }
      }
    },
    {
      "if": { "properties": { "event_type": { "const": "engagement.ack" } } },
      "then": {
        "properties": {
          "payload": {
            "type": "object",
            "additionalProperties": false,
            "required": ["correlation_id", "effector_id", "outcome", "rounds_consumed", "vendor_ack_at"],
            "properties": {
              "correlation_id": { "type": "string", "pattern": "^auth-[A-Za-z0-9._-]{4,128}$" },
              "effector_id": { "type": "string", "minLength": 1, "maxLength": 256 },
              "outcome": {
                "enum": [
                  "TARGET_NEUTRALISED",
                  "TARGET_HIT_UNCONFIRMED",
                  "TARGET_LOST",
                  "MISS",
                  "ENGAGEMENT_ABORTED",
                  "VENDOR_DECLINED",
                  "TIMEOUT_NO_ACK"
                ]
              },
              "rounds_consumed": { "type": "integer", "minimum": 0 },
              "vendor_ack_at": { "type": "string", "format": "date-time" }
            }
          }
        }
      }
    },
    {
      "if": { "properties": { "event_type": { "const": "abort.family_halt" } } },
      "then": {
        "properties": {
          "payload": {
            "type": "object",
            "additionalProperties": false,
            "required": ["aborter_ref", "effector_family", "affected_envelope_ids", "reason_code"],
            "properties": {
              "aborter_ref": { "$ref": "#/$defs/IdentityRef" },
              "effector_family": { "type": "string", "pattern": "^[a-z0-9][a-z0-9._-]*(/[a-z0-9*._-]+)+$" },
              "affected_envelope_ids": {
                "type": "array",
                "minItems": 1,
                "items": { "type": "string", "format": "uuid" }
              },
              "reason_code": { "type": "string", "pattern": "^ROU-ABORT-[A-Z0-9-]{2,64}$" },
              "reason_note": { "type": "string", "maxLength": 4096 }
            }
          }
        }
      }
    },
    {
      "if": { "properties": { "event_type": { "const": "abort.tenant_all" } } },
      "then": {
        "properties": {
          "payload": {
            "type": "object",
            "additionalProperties": false,
            "required": ["aborter_ref", "aborter_role_authority", "affected_envelope_ids", "reason_code"],
            "properties": {
              "aborter_ref": { "$ref": "#/$defs/IdentityRef" },
              "aborter_role_authority": { "type": "string", "pattern": "^[A-Z0-9_.-]{2,64}$" },
              "affected_envelope_ids": {
                "type": "array",
                "minItems": 1,
                "items": { "type": "string", "format": "uuid" }
              },
              "reason_code": { "type": "string", "pattern": "^ROU-ABORT-[A-Z0-9-]{2,64}$" },
              "reason_note": { "type": "string", "maxLength": 4096 }
            }
          }
        }
      }
    },
    {
      "if": { "properties": { "event_type": { "const": "magazine.updated" } } },
      "then": {
        "properties": {
          "payload": {
            "type": "object",
            "additionalProperties": false,
            "required": ["effector_id", "rounds_delta", "rounds_remaining_authorised", "magazine_cap_source_envelope_id"],
            "properties": {
              "effector_id": { "type": "string", "minLength": 1, "maxLength": 256 },
              "rounds_delta": { "type": "integer", "maximum": -1, "description": "Consumption only; strictly negative. Reloads are inventory events, not DEA events." },
              "rounds_remaining_authorised": { "type": "integer", "minimum": 0 },
              "magazine_cap_source_envelope_id": { "type": "string", "format": "uuid" }
            }
          }
        }
      }
    }
  ],
  "$defs": {
    "IdentityRef": {
      "type": "object",
      "additionalProperties": false,
      "required": ["npki_dn", "identity_hash"],
      "properties": {
        "npki_dn": { "type": "string", "minLength": 1, "maxLength": 512 },
        "identity_hash": { "type": "string", "pattern": "^[A-Fa-f0-9]{64}$" }
      }
    }
  }
}
