{
  "schema": "will.dea.event.v0",
  "event_id": "01895a40-0004-7c00-0000-000000000004",
  "event_type": "abort.tenant_all",
  "occurred_at": "2026-07-14T14:33:00.000Z",
  "tenant_id": "00000000-0000-0000-0000-000000000001",
  "envelope_id": null,
  "envelope_snapshot_hash": null,
  "classification": "NESECRET",
  "source_service": {
    "name": "will-doctrine",
    "version": "0.1.0",
    "instance_id": "will-doctrine-pod-a3f9"
  },
  "ledger_prev_hash": "0a1b2c3d4e5f60718293a4b5c6d7e8f90a1b2c3d4e5f6070818293a4b5c6d7e8",
  "payload": {
    "aborter_ref": {
      "npki_dn": "CN=Lt.Col. Petrescu, OU=CP Duty, O=MApN, C=RO",
      "identity_hash": "5c6d7e8f9a0b1c2d3e4f506172839495a6b7c8d9e0f1a2b3c4d5e6f708192a3b"
    },
    "aborter_role_authority": "RO_MOD.DUTY_OFFICER",
    "affected_envelope_ids": [
      "01895a2e-8d3c-7c00-8fbb-2b9f2a2b1c40",
      "01895a30-2f10-7c00-b45a-6d8e9f0a1b2c"
    ],
    "reason_code": "ROU-ABORT-TENANT-DIRECTED",
    "reason_note": "Command post directive at 14:32Z — cease all delegated engagement pending briefing at 14:45Z."
  },
  "signature": {
    "algorithm": "Ed25519",
    "key_ref": "vault://svc/will-doctrine/2026-q3",
    "value": "c2lnbmVkLWJ5LXdpbGwtZG9jdHJpbmU=",
    "signed_over": [
      "schema", "event_id", "event_type", "occurred_at", "tenant_id",
      "envelope_id", "envelope_snapshot_hash", "classification",
      "source_service", "ledger_prev_hash", "payload"
    ]
  }
}
